{
  "schemaVersion": "3.4.0",
  "phase": "GATE-7",
  "gate": "GATE-7",
  "status": "IN_PROGRESS",
  "branch": "main",
  "baseCommit": "d6deb90564011f9ee518da20acbb56a39b985f74",
  "currentCommit": "HEAD",
  "dirty": false,
  "startedAt": "2026-10-18T15:08:10Z",
  "updatedAt": "2026-10-19T03:33:23Z",
  "nextAllowedAction": "Complete current causal rework and unchanged owning regressions, retaining failed runtime-v1/v2 and every original producer byte. Refresh current memory, all198 requirements, explicit inventory and quiescent validation; publish a new unused immutable runtime-v3 and repeat one complete non-fast verifier followed by all ordered internal controls before actual READY_FOR_REVIEW sealing. Independent M2 audit remains pending; no Gate8 authority.",
  "blockedBy": [],
  "secondToolValidation": {
    "status": "PENDING_MANUAL",
    "tool": null,
    "provider": null,
    "model": null,
    "validatedAt": null,
    "justification": null,
    "evidence": []
  },
  "requirementsMatrix": {
    "path": "REQUIREMENTS-MATRIX.json",
    "total": 198,
    "mandatory": 197,
    "complete": 0,
    "partial": 51,
    "missing": 0,
    "notApplicable": 0,
    "coveragePercent": 0
  },
  "greenKeeper": {
    "status": "NOT_EXECUTED",
    "cycles": 0,
    "remainingFailures": 0,
    "unresolvedReworkItems": 0,
    "log": "REWORK-LOG.jsonl",
    "externalBlockers": [],
    "evidence": []
  },
  "deliveryCompleteness": {
    "status": "NOT_EXECUTED",
    "report": "COMPLETENESS-REPORT.json",
    "coveragePercent": 0,
    "evidenceCoveragePercent": 0,
    "auditor": null,
    "evidence": []
  },
  "reworkCycles": 0,
  "independentReview": {
    "status": "PENDING",
    "tool": null,
    "reviewedAt": null,
    "justification": null,
    "evidence": []
  },
  "redTeam": {
    "status": "PENDING",
    "tool": null,
    "executedAt": null,
    "justification": null,
    "evidence": []
  },
  "lessonPreflight": {
    "path": "LESSON-PREFLIGHT.json",
    "gate": "GATE-7",
    "scope": "Knowledge Engine governed source ingestion lexical indexing retrieval citations rights invalidation persistence privacy recovery and M2 internal audit handoff",
    "lessonsConsidered": 151,
    "lessonsApplicable": 150,
    "derivedRequirements": 150,
    "evidence": [
      "checkpoint:LESSON-PREFLIGHT.json"
    ]
  },
  "milestone": {
    "id": "M2",
    "title": "IACode V0 completion and experience",
    "gates": [
      "GATE 4",
      "GATE 5",
      "GATE 6",
      "GATE 7"
    ],
    "status": "PENDING",
    "auditor": null,
    "auditedAt": null,
    "evidence": []
  },
  "externalAuditRequired": false,
  "externalAuditReason": null,
  "guardrailEffectiveness": {
    "guardrailsTotal": 0,
    "guardrailsResolved": 0,
    "guardrailsTested": 0,
    "guardrailsEffective": 0,
    "guardrailFailures": 0,
    "evidence": []
  },
  "integrity": {
    "status": "PASS",
    "anchors": 35,
    "chainFile": ".iacode/anchors/checkpoint-chain.json",
    "evidence": [
      "command:cmd-0003"
    ]
  },
  "externalAttestation": {
    "status": "NONE",
    "path": null,
    "auditId": null,
    "evidence": []
  }
}
