{
  "schemaVersion": "3.4.0",
  "phase": "GATE-6",
  "gate": "GATE-6",
  "status": "IN_PROGRESS",
  "branch": "main",
  "baseCommit": "bcfe297278d25ee5a1db70a32b8c4ba0731941ea",
  "currentCommit": "HEAD",
  "dirty": false,
  "startedAt": "2026-10-17T11:34:14Z",
  "updatedAt": "2026-10-17T20:50:45Z",
  "nextAllowedAction": "Docker Desktop Server and canonical complete lint respond after the owner-authorized restart; cmd-0194 observes all37 prior other identities/states and old owned cleanup preserved, cmd-0196 root28 passes. Freeze current code/memory, publish immutable runtime-v4 at remote main, then execute every canonical non-fast stage using the normal supported Desktop context, not the raw Linux wrapper. Complete functional proof, all193 derived requirements, whole mandatory Green Keeper, completeness, internal Red Team/null control, full clean-clone closure mirror, canonical seal/publication/archive. Do not repeat owned cleanup or policy-refused removals. Independent M2 remains pending; Gate7 is not authorized.",
  "blockedBy": [],
  "secondToolValidation": {
    "status": "PENDING_MANUAL",
    "tool": null,
    "provider": null,
    "model": null,
    "validatedAt": null,
    "justification": null,
    "evidence": []
  },
  "requirementsMatrix": {
    "path": "REQUIREMENTS-MATRIX.json",
    "total": 193,
    "mandatory": 192,
    "complete": 0,
    "partial": 37,
    "missing": 0,
    "notApplicable": 0,
    "coveragePercent": 0
  },
  "greenKeeper": {
    "status": "FAIL",
    "cycles": 3,
    "remainingFailures": 1,
    "unresolvedReworkItems": 1,
    "log": "REWORK-LOG.jsonl",
    "externalBlockers": [],
    "evidence": [
      "command:cmd-0136",
      "command:cmd-0140",
      "command:cmd-0141",
      "command:cmd-0142",
      "command:cmd-0143",
      "command:cmd-0165",
      "command:cmd-0166",
      "checkpoint:attempts/DOCKER-RETRY-0002.json",
      "command:cmd-0192",
      "command:cmd-0194",
      "command:cmd-0196"
    ]
  },
  "deliveryCompleteness": {
    "status": "NOT_EXECUTED",
    "report": "COMPLETENESS-REPORT.json",
    "coveragePercent": 0,
    "evidenceCoveragePercent": 0,
    "auditor": null,
    "evidence": []
  },
  "reworkCycles": 3,
  "independentReview": {
    "status": "PENDING",
    "tool": null,
    "reviewedAt": null,
    "justification": null,
    "evidence": []
  },
  "redTeam": {
    "status": "PENDING",
    "tool": null,
    "executedAt": null,
    "justification": null,
    "evidence": []
  },
  "lessonPreflight": {
    "path": "LESSON-PREFLIGHT.json",
    "gate": "GATE-6",
    "scope": "Experience Store with observable source-bound engineering facts, privacy, provenance, storage and reuse rights, retention, authenticated API and recovery",
    "lessonsConsidered": 143,
    "lessonsApplicable": 142,
    "derivedRequirements": 142,
    "evidence": [
      "checkpoint:LESSON-PREFLIGHT.json",
      "checkpoint:REQUIREMENTS-MATRIX.json"
    ]
  },
  "milestone": {
    "id": "M2",
    "title": "IACode V0 completion and experience",
    "gates": [
      "GATE 4",
      "GATE 5",
      "GATE 6",
      "GATE 7"
    ],
    "status": "PENDING",
    "auditor": null,
    "auditedAt": null,
    "evidence": []
  },
  "externalAuditRequired": false,
  "externalAuditReason": null,
  "guardrailEffectiveness": {
    "guardrailsTotal": 145,
    "guardrailsResolved": 145,
    "guardrailsTested": 145,
    "guardrailsEffective": 145,
    "guardrailFailures": 0,
    "evidence": [
      "command:cmd-0054",
      "command:cmd-0050",
      "command:cmd-0141",
      "command:cmd-0145",
      "command:cmd-0146",
      "command:cmd-0165",
      "command:cmd-0166",
      "command:cmd-0178",
      "command:cmd-0196"
    ]
  },
  "integrity": {
    "status": "PASS",
    "anchors": 34,
    "chainFile": ".iacode/anchors/checkpoint-chain.json",
    "evidence": [
      "command:cmd-0003"
    ]
  },
  "externalAttestation": {
    "status": "NONE",
    "path": null,
    "auditId": null,
    "evidence": []
  }
}
