{
  "schemaVersion": "3.2.0",
  "phase": "M0 - final fresh-session independent audit of SETUP-00-CP-0010",
  "gate": "SETUP-00",
  "status": "REWORK_REQUIRED",
  "branch": "main",
  "baseCommit": "90b67a7e0a11179465bc5c92dee22c78da36801f",
  "currentCommit": "refs/tags/iacode-checkpoints/SETUP-00-CP-0011",
  "dirty": false,
  "startedAt": "2026-09-21T05:56:53Z",
  "updatedAt": "2026-09-21T08:21:43Z",
  "nextAllowedAction": "Return SETUP-00-CP-0011 to the implementer. Close CP11-F-001 so that a checkpoint which corrects no audit can obtain a passing internal mirror through the shipped tooling, re-run the whole delivery order, and request a new M0 audit. Gate 0 stays blocked.",
  "blockedBy": [
    "CP11-F-001"
  ],
  "secondToolValidation": {
    "status": "FAILED",
    "tool": "Claude Code 2.1.195, fresh session",
    "provider": "Anthropic",
    "model": "claude-opus-5",
    "validatedAt": "2026-09-21T07:40:00Z",
    "justification": "Fresh-session independent audit of SETUP-00-CP-0010. One critical finding. Same tool, provider and model as the implementing run, so this is session independence and not cross-tool validation, and it is not recorded as one.",
    "evidence": [
      "file:REVIEW-REPORT.md",
      "file:MILESTONE-REPORT.md",
      "file:AUDIT-EXECUTIONS.json"
    ]
  },
  "requirementsMatrix": {
    "path": "REQUIREMENTS-MATRIX.json",
    "total": 104,
    "mandatory": 102,
    "complete": 104,
    "partial": 0,
    "missing": 0,
    "notApplicable": 0,
    "coveragePercent": 100.0
  },
  "greenKeeper": {
    "status": "PASS",
    "cycles": 2,
    "remainingFailures": 0,
    "unresolvedReworkItems": 0,
    "log": "REWORK-LOG.jsonl",
    "externalBlockers": [],
    "evidence": [
      "command:cmd-0011",
      "command:cmd-0015"
    ],
    "requiredGates": [
      "tests",
      "staticAnalysis",
      "lessons",
      "integrity",
      "checkpointValidation"
    ]
  },
  "deliveryCompleteness": {
    "status": "PASS",
    "report": "COMPLETENESS-REPORT.json",
    "coveragePercent": 100.0,
    "evidenceCoveragePercent": 100.0,
    "auditor": "CP-0011 fresh-session independent auditor",
    "evidence": [
      "command:cmd-0016",
      "file:COMPLETENESS-REPORT.json"
    ]
  },
  "reworkCycles": 2,
  "independentReview": {
    "status": "REWORK_REQUIRED",
    "tool": "Claude Code 2.1.195, fresh session, Anthropic, claude-opus-5",
    "reviewedAt": "2026-09-21T07:40:00Z",
    "justification": "All five CP-0009 findings are closed and the attestation architecture works in both directions, but the internal mirror audit cannot pass for a checkpoint that corrects no audit, and checkpoint validation requires it to pass.",
    "evidence": [
      "file:REVIEW-REPORT.md",
      "file:FINAL-M0-AUDIT-MATRIX.json"
    ]
  },
  "redTeam": {
    "status": "RED_TEAM_PASS",
    "tool": "the adversarial battery of this audit, independent of m0_red_team.py",
    "executedAt": "2026-09-21T07:40:00Z",
    "justification": "37 scenarios executed against disposable copies of a sealed snapshot, one copy per scenario, over a null-mutation control that was accepted first. None escaped.",
    "evidence": [
      "file:RED-TEAM-REPORT.md",
      "file:M0-INTERNAL-RED-TEAM.json"
    ]
  },
  "lessonPreflight": {
    "path": "LESSON-PREFLIGHT.json",
    "gate": "SETUP-00",
    "scope": "independent-audit",
    "lessonsConsidered": 30,
    "lessonsApplicable": 30,
    "derivedRequirements": 30,
    "evidence": [
      "file:LESSON-PREFLIGHT.json",
      "command:cmd-0002"
    ]
  },
  "milestone": {
    "id": "M0",
    "title": "Development control plane",
    "gates": [
      "SETUP-00"
    ],
    "status": "FAILED",
    "auditor": "Claude Code fresh-session independent M0 audit (FRESH_SESSION_INDEPENDENT_AUDIT)",
    "auditedAt": "2026-09-21T07:40:00Z",
    "evidence": [
      "file:MILESTONE-REPORT.md",
      "file:REVIEW-REPORT.md",
      "file:AUDIT-EXECUTIONS.json"
    ]
  },
  "externalAuditRequired": false,
  "externalAuditReason": null,
  "guardrailEffectiveness": {
    "guardrailsTotal": 29,
    "guardrailsResolved": 29,
    "guardrailsTested": 29,
    "guardrailsEffective": 29,
    "guardrailFailures": 0,
    "evidence": [
      "file:.iacode/memory/guardrails/registry.json",
      "file:AUDIT-EXECUTIONS.json"
    ]
  },
  "integrity": {
    "status": "PASS",
    "anchors": 10,
    "chainFile": ".iacode/anchors/checkpoint-chain.json",
    "evidence": [
      "command:cmd-0003"
    ]
  },
  "externalAttestation": {
    "status": "PRESENT",
    "path": ".iacode/attestations/M0-CP-0011.json",
    "auditId": "M0-CP-0011",
    "subjectCheckpoint": "SETUP-00-CP-0010",
    "subjectCommit": "90b67a7e0a11179465bc5c92dee22c78da36801f",
    "validationMechanism": "FRESH_SESSION_INDEPENDENT_AUDIT",
    "evidence": [
      "file:MILESTONE-REPORT.md"
    ]
  }
}
