{
  "schemaVersion": "2.0.0",
  "phase": "SETUP-00 - Corrective Control-Plane Hardening",
  "gate": "SETUP-00",
  "status": "READY_FOR_REVIEW",
  "branch": "main",
  "baseCommit": "ae563f860856e3ce5ca9ec6e94b6202ed7e4a4e4",
  "currentCommit": "refs/tags/iacode-checkpoints/SETUP-00-CP-0003",
  "dirty": false,
  "startedAt": "2026-09-20T05:30:40Z",
  "updatedAt": "2026-09-20T06:10:09Z",
  "nextAllowedAction": "Independent validation by Codex: review, Red Team, and a new checkpoint recording secondToolValidation. Gate 0 stays blocked.",
  "blockedBy": [],
  "secondToolValidation": {
    "status": "PENDING_MANUAL",
    "tool": null,
    "provider": null,
    "model": null,
    "validatedAt": null,
    "justification": null,
    "evidence": []
  }
}
